commit	val_score	triggers	status	description
59fa533	0.227728	5000	discard	E=E097/cc_oi_r6_align_short X=X012/ladder_3_steps_atr | n_var=90000 best_tp=0.32 best_sl=6.00 elapsed=3.1s
59fa533	0.227728	5000	discard	E=E098/cc_pc_pump_no_oi_5m_short X=X012/ladder_3_steps_atr | n_var=90000 best_tp=0.32 best_sl=6.00 elapsed=3.1s
59fa533	0.229467	5000	discard	E=E099/cc_pc_crash_no_r6_long X=X012/ladder_3_steps_atr | n_var=90000 best_tp=0.32 best_sl=6.00 elapsed=3.1s
59fa533	0.229467	5000	discard	E=E100/cc_pc_then_oi_funding_align_long X=X012/ladder_3_steps_atr | n_var=90000 best_tp=0.32 best_sl=6.00 elapsed=3.1s
59fa533	0.140131	611	discard	E=E101/oi_pump_taker_buy_extreme_long X=X012/ladder_3_steps_atr | n_var=90000 best_tp=0.28 best_sl=5.92 elapsed=0.4s
59fa533	0.014333	611	discard	E=E102/oi_pump_taker_buy_extreme_short_pretrend_neg X=X012/ladder_3_steps_atr | n_var=90000 best_tp=0.20 best_sl=4.91 elapsed=0.4s
59fa533	0.096481	250	discard	E=E103/oi_crash_basis_widening_short X=X012/ladder_3_steps_atr | n_var=90000 best_tp=0.28 best_sl=5.57 elapsed=0.3s
59fa533	0.297243	250	discard	E=E104/oi_crash_basis_narrowing_long X=X012/ladder_3_steps_atr | n_var=90000 best_tp=0.59 best_sl=4.60 elapsed=0.3s
59fa533	0.059914	878	discard	E=E105/oi_pump_2nd_signal_5m_short X=X012/ladder_3_steps_atr | n_var=90000 best_tp=0.20 best_sl=4.91 elapsed=0.9s
59fa533	0.123657	1401	discard	E=E106/oi_pump_3rd_plus_avoid X=X012/ladder_3_steps_atr | n_var=90000 best_tp=0.24 best_sl=5.49 elapsed=1.2s
59fa533	0.096481	250	discard	E=E107/oi_crash_btc_correlated_short X=X012/ladder_3_steps_atr | n_var=90000 best_tp=0.28 best_sl=5.57 elapsed=0.3s
59fa533	0.297243	250	discard	E=E108/oi_crash_idiosyncratic_long X=X012/ladder_3_steps_atr | n_var=90000 best_tp=0.59 best_sl=4.60 elapsed=0.3s
59fa533	-0.043817	226	discard	E=E109/oi_pump_high_premium_immediate_short X=X012/ladder_3_steps_atr | n_var=90000 best_tp=0.20 best_sl=4.87 elapsed=0.2s
59fa533	-0.043817	226	discard	E=E110/oi_pump_high_premium_delayed_short X=X012/ladder_3_steps_atr | n_var=90000 best_tp=0.20 best_sl=4.87 elapsed=0.2s
59fa533	0.084623	878	discard	E=E111/oi_pump_funding_normalized_long X=X012/ladder_3_steps_atr | n_var=90000 best_tp=0.20 best_sl=4.48 elapsed=0.9s
59fa533	0.000000	0	crash	E=E112/oi_pump_funding_extreme_pos_short X=X012/ladder_3_steps_atr | error=no_events_for_channel
59fa533	0.000000	0	crash	E=E113/oi_pump_funding_extreme_neg_long X=X012/ladder_3_steps_atr | error=no_events_for_channel
59fa533	0.297243	250	discard	E=E114/oi_change_mfi_oversold_long X=X012/ladder_3_steps_atr | n_var=90000 best_tp=0.59 best_sl=4.60 elapsed=0.3s
59fa533	0.059914	878	discard	E=E115/oi_change_mfi_overbought_short X=X012/ladder_3_steps_atr | n_var=90000 best_tp=0.20 best_sl=4.91 elapsed=0.9s
59fa533	0.003027	224	discard	E=E116/oi_pump_session_us_long X=X012/ladder_3_steps_atr | n_var=90000 best_tp=0.20 best_sl=4.17 elapsed=0.2s
59fa533	0.010412	334	discard	E=E117/oi_pump_session_asia_short X=X012/ladder_3_steps_atr | n_var=90000 best_tp=0.20 best_sl=4.40 elapsed=0.3s
59fa533	0.059914	878	discard	E=E118/oi_pump_weekend_short X=X012/ladder_3_steps_atr | n_var=90000 best_tp=0.20 best_sl=4.91 elapsed=0.9s
59fa533	0.123657	1401	discard	E=E119/oi_pump_macro_event_avoid X=X012/ladder_3_steps_atr | n_var=90000 best_tp=0.24 best_sl=5.49 elapsed=1.2s
59fa533	0.084623	878	discard	E=E120/oi_pump_2x_avg_volume_long X=X012/ladder_3_steps_atr | n_var=90000 best_tp=0.20 best_sl=4.48 elapsed=0.9s
59fa533	0.059914	878	discard	E=E121/oi_pump_5x_avg_volume_short X=X012/ladder_3_steps_atr | n_var=90000 best_tp=0.20 best_sl=4.91 elapsed=0.9s
59fa533	0.000000	0	crash	E=E122/oi_pump_volume_pct_ranked_long X=X012/ladder_3_steps_atr | error=no_events_for_channel
59fa533	-0.112078	141	discard	E=E123/oi_pump_oi_ranked_long X=X012/ladder_3_steps_atr | n_var=90000 best_tp=0.20 best_sl=4.48 elapsed=0.1s
59fa533	0.136220	92	discard	E=E124/oi_pump_funding_ranked_short X=X012/ladder_3_steps_atr | n_var=90000 best_tp=0.43 best_sl=3.86 elapsed=0.1s
59fa533	0.096009	970	discard	E=E125/oi_change_imbalanced_book_long X=X012/ladder_3_steps_atr | n_var=90000 best_tp=0.20 best_sl=4.48 elapsed=0.9s
59fa533	0.385518	3456	discard	E=E126/pc_pump_taker_buy_extreme_long X=X012/ladder_3_steps_atr | n_var=90000 best_tp=0.51 best_sl=6.00 elapsed=2.3s
59fa533	0.245330	3456	discard	E=E127/pc_pump_taker_buy_extreme_against_pretrend_short X=X012/ladder_3_steps_atr | n_var=90000 best_tp=0.36 best_sl=6.00 elapsed=2.3s
59fa533	0.265848	5000	discard	E=E128/pc_pump_basis_diverge_short X=X012/ladder_3_steps_atr | n_var=90000 best_tp=0.36 best_sl=6.00 elapsed=3.1s
59fa533	0.284182	5000	discard	E=E129/pc_pump_basis_align_long X=X012/ladder_3_steps_atr | n_var=90000 best_tp=0.39 best_sl=6.00 elapsed=3.1s
59fa533	0.265848	5000	discard	E=E130/pc_pump_2nd_within_30s_overheated_short X=X012/ladder_3_steps_atr | n_var=90000 best_tp=0.36 best_sl=6.00 elapsed=3.1s
59fa533	0.284182	5000	discard	E=E131/pc_pump_4th_or_more_avoid X=X012/ladder_3_steps_atr | n_var=90000 best_tp=0.39 best_sl=6.00 elapsed=3.1s
59fa533	0.284182	5000	discard	E=E132/pc_pump_btc_extreme_correlated_long X=X012/ladder_3_steps_atr | n_var=90000 best_tp=0.39 best_sl=6.00 elapsed=3.1s
59fa533	0.284182	5000	discard	E=E133/pc_pump_btc_no_correlation_long X=X012/ladder_3_steps_atr | n_var=90000 best_tp=0.39 best_sl=6.00 elapsed=3.1s
59fa533	0.103552	1178	discard	E=E134/pc_pump_premium_extreme_immediate_short X=X012/ladder_3_steps_atr | n_var=90000 best_tp=0.20 best_sl=5.92 elapsed=1.0s
59fa533	0.103552	1178	discard	E=E135/pc_pump_premium_extreme_delayed_short X=X012/ladder_3_steps_atr | n_var=90000 best_tp=0.20 best_sl=5.92 elapsed=1.0s
59fa533	0.284182	5000	discard	E=E136/pc_pump_funding_resetting_long X=X012/ladder_3_steps_atr | n_var=90000 best_tp=0.39 best_sl=6.00 elapsed=3.1s
59fa533	0.000000	0	crash	E=E137/pc_pump_funding_extreme_pos_short X=X012/ladder_3_steps_atr | error=no_events_for_channel
59fa533	0.000000	0	crash	E=E138/pc_pump_funding_extreme_neg_long X=X012/ladder_3_steps_atr | error=no_events_for_channel
59fa533	0.284182	5000	discard	E=E139/pc_pump_volume_5x_baseline_long X=X012/ladder_3_steps_atr | n_var=90000 best_tp=0.39 best_sl=6.00 elapsed=3.1s
59fa533	0.265848	5000	discard	E=E140/pc_pump_volume_below_baseline_short X=X012/ladder_3_steps_atr | n_var=90000 best_tp=0.36 best_sl=6.00 elapsed=3.1s
59fa533	0.224011	1370	discard	E=E141/pc_pump_session_us_long X=X012/ladder_3_steps_atr | n_var=90000 best_tp=0.36 best_sl=6.00 elapsed=1.2s
59fa533	0.195668	1388	discard	E=E142/pc_pump_session_asia_short X=X012/ladder_3_steps_atr | n_var=90000 best_tp=0.32 best_sl=5.73 elapsed=1.2s
59fa533	0.265848	5000	discard	E=E143/pc_pump_weekend_short X=X012/ladder_3_steps_atr | n_var=90000 best_tp=0.36 best_sl=6.00 elapsed=3.1s
59fa533	0.284182	5000	discard	E=E144/pc_pump_macro_event_avoid X=X012/ladder_3_steps_atr | n_var=90000 best_tp=0.39 best_sl=6.00 elapsed=3.1s
59fa533	0.115198	971	discard	E=E145/pc_pump_top_trader_long_short X=X012/ladder_3_steps_atr | n_var=90000 best_tp=0.24 best_sl=4.56 elapsed=0.9s
59fa533	0.251693	983	discard	E=E146/pc_pump_top_trader_short_long X=X012/ladder_3_steps_atr | n_var=90000 best_tp=0.39 best_sl=4.79 elapsed=1.0s
59fa533	0.130656	1004	discard	E=E147/pc_pump_global_long_high_short X=X012/ladder_3_steps_atr | n_var=90000 best_tp=0.24 best_sl=5.61 elapsed=1.0s
59fa533	0.347593	979	discard	E=E148/pc_pump_global_short_high_long X=X012/ladder_3_steps_atr | n_var=90000 best_tp=0.55 best_sl=5.81 elapsed=0.9s
59fa533	0.284182	5000	discard	E=E149/pc_pump_aggressive_buy_immediate_long X=X012/ladder_3_steps_atr | n_var=90000 best_tp=0.39 best_sl=6.00 elapsed=3.1s
59fa533	0.265848	5000	discard	E=E150/pc_pump_aggressive_sell_short X=X012/ladder_3_steps_atr | n_var=90000 best_tp=0.36 best_sl=6.00 elapsed=3.1s
